{"schemaVersion":1,"artifactType":"website-change-request","projectRoot":"C:/projects/site","contextId":"site-context-example","contextSha256":"0000000000000000000000000000000000000000000000000000000000000000","measurementPlanId":"measure-example","measurementPlanSha256":"1111111111111111111111111111111111111111111111111111111111111111","route":"direct","intents":[{"kind":"DIRECT_TAG","publicId":"G-TEST12345"}],"verificationCommands":[],"networkAllowed":false,"deploymentApproved":false}
